{"artifact":"ibex_benchmark","schema_version":2,"recorded_at":"2026-08-10T12:01:41Z","environment":{"ruby_engine":"ruby","ruby_version":"4.0.0","ruby_platform":"arm64-darwin24","ibex_version":"0.2.0","host_os":"darwin24","host_cpu":"arm64","processors":12},"configuration":{"grammar":"benchmark/grammars/representative.y","input":"benchmark/grammars/representative.input","seed":12345,"build_iterations":5,"runtime_iterations":1000},"measurements":{"generation_ms":37.014,"runtime_parse_ms":{"plain":1.12,"compact":0.455},"peak_rss_bytes":64995328,"stage_ms":{"parse":7.307,"normalize":1.555,"automaton":22.244,"table_plain":0.378,"table_compact":5.055,"codegen_plain":1.442,"codegen_compact":5.908}},"structure":{"productions":139,"final_states":250,"tables":{"plain":{"action_cells":2115,"goto_cells":533,"default_cells":250,"total_cells":2898,"bytes":47522},"compact":{"action_cells":5848,"goto_cells":1522,"default_cells":250,"total_cells":7620,"bytes":51999}},"generated_output_bytes":{"plain":63376,"compact":23048},"construction_strategy":"direct_lalr","construction_intermediate_states":250},"digests":{"grammar_source_sha256":"67f98993230a3435c1b1a8b4797d33790b88ba58a0acdd44d68fafb05e8c6344","runtime_input_sha256":"4693d9c773ea2ffab9937afbd557077c2c418fd7c412012ba100bf917f3d5a5a","grammar_ir_sha256":"1229b96ee6cb94b9a95905c8c48a4268f323223ab141c7bc299cd24ed9e31306","automaton_ir_sha256":"f14ee1546f7a4b003be592baf451d914a2bb5f7ac04f7acd9a64d3166e08a19f","plain_tables_sha256":"98c0f2591bf190c3d7ba50fd75e993089f54a5095aee13bc5bf51541655d7505","compact_tables_sha256":"9ec120d70fa135e9d8e96885605e128bb2b1109ca04cbae0106c425892f28e89","plain_output_sha256":"37469c91c0350db37df5933e9a8a8e8fbf3b9047c8a146692fec9f27b51aabfd","compact_output_sha256":"69545dfd53a87f7236fe856c01cfebea2a1e944f9a796dbb5228277f8571b918","runtime_result_sha256":"3fdba35f04dc8c462986c992bcf875546257113072a909c162f7e470e581e278","artifact_sha256":"733334f385866b8326ff0cdd6cb70ea8f35073a5461e9d1b3a77efd3c76d09b6"}}
